{
  "catalog": {
    "sourceDigest": {
      "algorithm": "sha256",
      "value": "60f39606e3517b30901821cd77b6567b8113a78a2a761cec7aff87855f20abd1"
    },
    "version": "tl-rewrite-rules/v1"
  },
  "commands": [
    "make ci",
    "make spec",
    "quire coverage --scope . --strict",
    "RUSTDOCFLAGS=-Dwarnings cargo doc --no-deps --all-features",
    "cargo tree --no-default-features --edges normal",
    "make check-corpus",
    "git diff --check origin/main...a889382df7fd6ef116f4ca18186c21562feadefa",
    "validate local evidence schemas and exact merged PGM-01 envelope",
    "python3 scripts/build_evidence_envelope.py EVIDENCE_DIR final",
    "validate exact finalized PGM-01 envelope",
    "python3 scripts/finalize_collection.py EVIDENCE_DIR"
  ],
  "corpus": {
    "checksumDigest": {
      "algorithm": "sha256",
      "value": "bde870f9bd32a5eb85ad387a7106868f7c525fe99e45abf5d3b749178c77b74d"
    },
    "licenseDigest": {
      "algorithm": "sha256",
      "value": "bbd006e62db999ba452d32df410c24c96293cf1e1c6b5d47ef8201355242fde6"
    },
    "manifestDigest": {
      "algorithm": "sha256",
      "value": "28b3562832cb9e14f8aef8cbdde97909ba91bfbc543b78ed657b73de12f49490"
    },
    "revision": "tl-rewrite-corpus/v1",
    "westSourceRevision": "21cd99ab2e6095a099dd179029cfdeb54268ad3f"
  },
  "dependencies": {
    "cargoLockDigest": {
      "algorithm": "sha256",
      "value": "146c9e2ce6fb615240d0acbe76be29aea5383c0b5f9c49c37ed69e661d8f8c60"
    },
    "tlMltlRevision": "da2c7704a5347d063398c852acf6aa5bf9b5752d",
    "tlSyntaxRevision": "740182f13b84858008d6f176f75136737d405c1b"
  },
  "pgm01": {
    "candidateRevision": "7dac9d8c19952412b56a0347387666e2ca81e01d",
    "envelopeSchema": "quire.derivation-evidence/v1",
    "envelopeSchemaDigest": {
      "algorithm": "sha256",
      "value": "0946e235e9e4b0fa79e9b9ec27ae157b303c17de0a9408d3cc04968fb7152256"
    },
    "policy": "ix://agent-ix/quire-contract-ir/PGM-01"
  },
  "schemaVersion": "tl-rewrite.evidence-input/v1",
  "sourceRevision": "a889382df7fd6ef116f4ca18186c21562feadefa",
  "sourceState": "clean",
  "tools": {
    "cargo": "cargo 1.94.1 (29ea6fb6a 2026-03-24)",
    "jsonschema": "3.2.0",
    "jsonschemaFormatCheckers": [
      "date",
      "date-time",
      "email",
      "hostname",
      "idn-email",
      "idn-hostname",
      "ipv4",
      "ipv6",
      "json-pointer",
      "regex",
      "relative-json-pointer",
      "time",
      "uri",
      "uri-reference"
    ],
    "python": "Python 3.10.12",
    "pythonPath": "/usr/bin/python3.10",
    "quire": "0.31.0",
    "rustc": "rustc 1.94.1 (e408947bf 2026-03-25)"
  }
}
